{
  "v": "ACDC10JSON00011c_",
  "d": "EYo4R9I08Et5H5SWKG8ZMS83r8FmRtfahN0V9NbG9zdw",
  "i": "did:keri:Ei5csblWpTy22uVkbZrZxvSUORxPvIlrfpq2e1hKTtfA",
  "ri": "did:keri:EymRy7xMwsxUelUauaXtMxTfPAMPAI6FkekwlOjkggt",
  "s": "ECcj1CBn4dpo6ZOmZQNtAjXxT4_MsVXipt5VTPjvSAf0",
  "a": {
    "d": "Ea4ny_YZAtAGUwGSyH7iFiKjpM3yFiDHcjrdomqt7Ryk",
    "i": "did:keri:EP2ukuiw_0xcp943NWz4IRnNtxwx7rzROwV1D_ZRP0XQ",
    "dt": "2021-06-09T17:35:54.169967+00:00",
    "LEI": "5493001KJTIIGC8Y1R12"
  },
  "r": {
    "d": "EDIai3Wkd-Z_4cezz9nYEcCK3KNH5saLvZoS_84JL6NU",
    "usageDisclaimer": {
      "l": "Usage of a valid, unexpired, and non-revoked vLEI Credential, as defined in the associated Ecosystem Governance Framework, does not assert that the Legal Entity is trustworthy, honest, reputable in its business dealings, safe to do business with, or compliant with any laws or that an implied or expressly intended purpose will be fulfilled."
    },
    "issuanceDisclaimer": {
      "l": "All information in a valid, unexpired, and non-revoked vLEI Credential, as defined in the associated Ecosystem Governance Framework, is accurate as of the date the validation process was complete. The vLEI Credential has been issued to the legal entity or person named in the vLEI Credential as the subject; and the qualified vLEI Issuer exercised reasonable care to perform the validation process set forth in the vLEI Ecosystem Governance Framework."
    }
  }
}
